### ISSUE TITLE
Duplicate ping reply

### ISSUE THREAD

**Issue by ocochard** [gvnn3/FreeVRRPd#5]
There is a small bug:
If we continuously ping the VRRP address, it start to generate duplicate echo reply.
Here is an example after about 3200 pings (192.168.2.254 is a VRRP address managed by FreeVRRPd):

```
64 bytes from 192.168.2.254: icmp_seq=3210 ttl=64 time=0.083 ms
64 bytes from 192.168.2.254: icmp_seq=3211 ttl=64 time=0.079 ms
64 bytes from 192.168.2.254: icmp_seq=3212 ttl=64 time=0.084 ms
64 bytes from 192.168.2.254: icmp_seq=3213 ttl=64 time=0.077 ms
64 bytes from 192.168.2.254: icmp_seq=3214 ttl=64 time=0.078 ms
64 bytes from 192.168.2.254: icmp_seq=3215 ttl=64 time=0.077 ms
64 bytes from 192.168.2.254: icmp_seq=3216 ttl=64 time=0.081 ms
64 bytes from 192.168.2.254: icmp_seq=3216 ttl=64 time=0.083 ms (DUP!)
64 bytes from 192.168.2.254: icmp_seq=3217 ttl=64 time=0.082 ms
64 bytes from 192.168.2.254: icmp_seq=3217 ttl=64 time=0.084 ms (DUP!)
64 bytes from 192.168.2.254: icmp_seq=3218 ttl=64 time=0.080 ms
64 bytes from 192.168.2.254: icmp_seq=3218 ttl=64 time=0.083 ms (DUP!)
64 bytes from 192.168.2.254: icmp_seq=3219 ttl=64 time=0.082 ms
64 bytes from 192.168.2.254: icmp_seq=3219 ttl=64 time=0.084 ms (DUP!)
64 bytes from 192.168.2.254: icmp_seq=3220 ttl=64 time=0.080 ms
64 bytes from 192.168.2.254: icmp_seq=3220 ttl=64 time=0.082 ms (DUP!)
64 bytes from 192.168.2.254: icmp_seq=3221 ttl=64 time=0.080 ms
64 bytes from 192.168.2.254: icmp_seq=3221 ttl=64 time=0.082 ms (DUP!)
64 bytes from 192.168.2.254: icmp_seq=3222 ttl=64 time=0.084 ms
64 bytes from 192.168.2.254: icmp_seq=3222 ttl=64 time=0.086 ms (DUP!)
64 bytes from 192.168.2.254: icmp_seq=3223 ttl=64 time=0.081 ms
64 bytes from 192.168.2.254: icmp_seq=3223 ttl=64 time=0.083 ms (DUP!)
64 bytes from 192.168.2.254: icmp_seq=3224 ttl=64 time=0.082 ms
64 bytes from 192.168.2.254: icmp_seq=3224 ttl=64 time=0.084 ms (DUP!)
64 bytes from 192.168.2.254: icmp_seq=3225 ttl=64 time=0.081 ms
64 bytes from 192.168.2.254: icmp_seq=3225 ttl=64 time=0.083 ms (DUP!)
```
And a tcpdump (on a different interface) display the same behavior:

```
13:32:00.504686 IP 192.168.1.3 > 192.168.1.254: ICMP echo request, id 33545, seq 44, length 64
13:32:00.504765 IP 192.168.1.254 > 192.168.1.3: ICMP echo reply, id 33545, seq 44, length 64
13:32:00.504769 IP 192.168.1.254 > 192.168.1.3: ICMP echo reply, id 33545, seq 44, length 64
13:32:01.275301 IP 192.168.1.1 > 224.0.0.18: VRRPv2, Advertisement, vrid 1, prio 101, authtype simple, intvl 1s, length 20
13:32:01.505689 IP 192.168.1.3 > 192.168.1.254: ICMP echo request, id 33545, seq 45, length 64
13:32:01.505766 IP 192.168.1.254 > 192.168.1.3: ICMP echo reply, id 33545, seq 45, length 64
13:32:01.505770 IP 192.168.1.254 > 192.168.1.3: ICMP echo reply, id 33545, seq 45, length 64
```

But I didn't see any ICMP related code into FreeVRRPd, then I'm not sure this problem came from netgraph.
My very simple setup [is described here](https://bsdrp.net/documentation/examples/simple_vrrp_lab) and using a /24 or /32 mask for the virtual address didn't change the behavior.
FreeBSD 10.3 and 11.0 have the same behavior, I didn't try with older release.
